{
  "spec_version": "handoff.v1",
  "handoff_id": "def456",
  "kind": "mail_headers",
  "created_at": "2026-02-20T00:00:00Z",
  "meta": {
    "provider": "gmail",
    "folder": "INBOX",
    "count": 2
  },
  "payload": {
    "headers": [
      {
        "id": "m1",
        "date": "2026-02-20T00:00:00Z",
        "sender": "a@example.com",
        "subject": "One"
      },
      {
        "id": "m2",
        "date": "2026-02-19T00:00:00Z",
        "sender": "b@example.com",
        "subject": "Two"
      }
    ]
  }
}
